<?xml version="1.0" encoding="utf-8"?>
<modulos xmlns:xsi="http://www.w3.org/2001/XMLSchema-instance" xsi:noNamespaceSchemaLocation="modulos.xsd">
        <nombre> Lenguaje de marcas </nombre>
        <contenidos>
            <bloque>
                <UnidadDidactica>
                    <tipo>lenguaje de transformacion</tipo>
                    <descripcion>Consta de ficheros xml, dtd y xsd</descripcion>
                </UnidadDidactica>	 
            </bloque>
        </contenidos>
        <nombre> Programacion </nombre>
        <contenidos>
            <bloque>
                <UnidadDidactica>
                    <tipo>Java FX</tipo>
                    <descripcion>Aplicacion de juego con Java FX</descripcion>
                </UnidadDidactica>	 
            </bloque>
        </contenidos>
        <nombre> Base de datos </nombre>
        <contenidos>
            <bloque>
                <UnidadDidactica>
                    <tipo> Lenguaje SQL y DDL </tipo>
                    <descripcion> Transformacion de Base de datos a DDL</descripcion>
                </UnidadDidactica>	 
            </bloque>
        </contenidos>
</modulos>